{
  "version": "1.0",
  "matrix_id": "pup-m6-fixture",
  "matrix_version": "0.1.0",
  "generated_at": "2026-09-16T00:00:00+08:00",
  "entries": [
    {
      "profile_id": "animated-explainer-course-remotion-batch-v2",
      "profile_version": "0.1.0",
      "profile_ref": "tests/fixtures/production_units/m6_0a_qualification_profile.fixture.json",
      "profile_sha256": "sha256:91dd25b0c0584706dac346cea05198126c27aab18af8e05197a722c5a82d3f87",
      "selector": {
        "pipeline": "animated-explainer",
        "content_form": "course_form",
        "supported_stages": ["script", "clp", "scene_plan", "assets", "edit", "compose"],
        "render_runtime": "remotion",
        "composition_mode": "templated",
        "asset_route": "batch_v2_owned",
        "provider": "gemini_omni",
        "model": "gemini-omni-flash-preview",
        "media_profile": "course-h264-1080p"
      },
      "manifest_supported": true,
      "qualification_status": "experimental",
      "reason": "Synthetic M6.0A contract fixture; it makes no beta or production claim."
    }
  ]
}
